{
  "schema_version": 1,
  "task_id": "paper-backed-coverage-challenger-v1",
  "source": {
    "source_excerpt_path": "examples/fresh-agent-evals/fixtures/challenger-research/trial-inputs/primary-source-excerpt.md",
    "source_excerpt_sha256": "08ecc9767bf0f37055bbda96999dc97c80a86918038ef3ca833b5b3367bd7373",
    "title": "Illuminating search spaces by mapping elites",
    "authors": ["Jean-Baptiste Mouret", "Jeff Clune"],
    "year": 2015,
    "identifier": "arXiv:1504.04909",
    "url": "https://arxiv.org/abs/1504.04909",
    "paraphrase": "MAP-Elites organizes solutions by chosen descriptors and retains strong representatives in different cells, exposing variation across a search space rather than only its best overall solution."
  },
  "research": {
    "mechanism_explanation": "The paper's descriptor map motivates treating each loaded eligible rotation-feature pair as a separate construction cell. The callback shuffles the cell order with the supplied seed, then cycles through active finite streams, yielding one distinct JSON payload per cell turn. It removes exhausted streams, deduplicates exact canonical payloads, and rejects explicitly supplied depth fields outside 1 through min(6, ctx.depth). This is a coverage-oriented scheduling adaptation, not MAP-Elites: it receives no evaluated fitness feedback and maintains no elite archive. Only the independent evaluator establishes true depth, eligibility, quality and completed cell visits.",
    "hypothesis": "At the matched completed-call target, balancing proposals across descriptor cells will produce a positive mean paired difference in unique valid cells against synthetic_uniform_pair_selector_v1 across the four development input-seed pairs. Synthetic quality passes are a separate descriptive outcome with no predicted improvement.",
    "falsifier": "A mean paired unique-valid-cell difference at or below zero across complete matched development comparisons would fail this coverage hypothesis. Any incomplete arm prevents the planned complete-budget comparison and must retain its actual counts. Positive development differences do not establish a generalization result or live trading usefulness."
  },
  "machine_claims": {
    "evaluation_scope": "synthetic_fixture_only",
    "comparison_report_path": "trial-output/comparison-report.json",
    "comparison_report_sha256": "ba8fd3f2ce1a7dcbc23c0bb2a9eac453e683593572b1994c666ddc48ae0a37de",
    "implementation_path": "trial-output/challenger.py",
    "implementation_sha256": "42fd224693ecd425f829bf951899be2dfaa45ae6a8c96332c10239e0d6bedd77",
    "series_id": "completion-reliability-research-4",
    "series_manifest_path": "examples/fresh-agent-evals/research/series/completion-reliability-research-4.json",
    "series_manifest_sha256": "a852b5d5e84a4d6dddb9e9df12454603ad0bcdcd89ecf444d646567d950eac7c",
    "reference_identity": "synthetic_uniform_pair_selector_v1",
    "synthetic_uniform_is_genetic": false,
    "synthetic_quality_scope": "fixture_only",
    "synthetic_comparison_interpretation": "descriptive_only",
    "live_performance": {"status": "unknown", "value": null},
    "out_of_sample_return_correlation": {"status": "unknown", "value": null},
    "server_acceptance": {"status": "unknown", "value": null},
    "genetic_reference_target": {
      "algorithm": "genetic",
      "target_completed_simulations": 100000,
      "observed_completed_simulations": null,
      "status": "unmeasured_target"
    }
  },
  "human_review": {
    "summary": "The independent development report records complete_equal_calls for all four pairs: each arm completed 4 of 4 calls per run, or 16 per arm in total. In alpha seeds 11 and 29, challenger/reference cell counts were 3/3 and 3/3, with quality passes 2/1 and 1/2. In beta seeds 11 and 29, cells were 3/2 and 4/2, with quality passes 2/2 and 1/2. Coverage differences average +0.75 cells; quality differences are mixed. These are descriptive synthetic observations only, with no held-out results included.",
    "rationale": "Balancing finite streams is a small auditable way to explore the paper-motivated coverage hypothesis without ranking by hidden quality. The implementation is locally authored and uses only the documented test context. The hypothesis is recorded with the result, not claimed as a timestamped preregistration. The reported positive development coverage difference is not evidence that the paper predicts callback superiority. A limitation is that payload fields do not certify evaluator-owned metadata: the evaluator rejected one over-depth challenger proposal in alpha seed 29 and one in beta seed 11 despite the explicit depth-field guard. Those attempts were not completed evaluations, and the callback must not be treated as a certified live depth validator. All quality bits and eligible denominators are fixture-only. Return correlation, live performance and server acceptance remain unobserved; the separate genetic 100,000-simulation target is unmeasured."
  }
}
